clinic,city,website,phone,booking_platform,online_booking,chat_or_ai,design,score,leak_angle
Centre Laser Lyon,Lyon,https://www.centrelaserlyon.fr/,04 37 42 09 25,Doctolib,YES,NO,modern,WARM,"Doctolib books the decided patient instantly but has zero qualification — hesitant/price-comparing enquiries about laser vs injectables get no response outside business hours"
Dermo Laser Lyon,Lyon,https://www.dermo-laser-lyon.fr/,04 28 29 80 07,own form + WhatsApp click-to-chat,YES,PARTIAL,modern,WARM,"Already pays for WhatsApp traffic (widget present) but a human must answer manually — no qualification, no after-hours coverage; the exact half-built version of what we sell"
Centre Laser Nice (Le Verdun),Nice,https://www.centrelasernice.fr/,04 22 53 50 65,Doctolib,YES,NO,modern,WARM,"Full aesthetic-medicine menu (fillers, Botox, body contouring) with zero pre-booking qualification — high-ticket injectable consults booked with the same friction as a €45 laser session"
Le Plénitude by Adeline,Strasbourg,https://leplenitude.fr/,(not listed on-site),Planity,YES,NO,modern,WARM,"Planity books the slot but the free 30-min consult (their main conversion tool) has no digital qualification step before an in-person visit is used up"
Les Définitives,Toulouse (Villeneuve-Tolosane),https://www.lesdefinitives.fr/,07 66 77 60 17,Planity,YES,NO,modern,WARM,"Active TikTok/social presence driving DM interest, but Planity link is the only conversion path — no AI to catch the DM that never becomes a booking"
Centre Laser Matabiau,Toulouse,https://centrelaser3bddesminimes.com/,06 01 92 04 93,NONE,NO,NO,modern-ish,HOT,"No booking system at all — contact form or phone only. Every after-hours or busy-line enquiry for a laser/aesthetic-medicine consult is a pure loss"
Aesthemedica Forme Beauté Bien-Etre,Bordeaux,https://www.planity.com/aesthemedica-forme-beaute-bien-etre-33200-bordeaux,(via Planity only),Planity,YES,NO,n/a — no independent site,WARM,"Zero brand-owned web presence — 100% dependent on Planity's own directory for discovery AND booking. No ability to run their own ads with a real landing/qualification layer"
